{
  "$schema": "./ship_manifest.schema.json",
  "manifest_version": "1.0.0",
  "project": "Rebellion",
  "asset_root": "assets/ships",
  "defaults": {
    "orientation": "nose_up",
    "alpha_required": true,
    "interpolation": "linear",
    "tint_mode": "none"
  },
  "ships": [
    {
      "type_id": 587,
      "slug": "rifter",
      "name": "Rifter",
      "faction": "minmatar",
      "class": "frigate",
      "sprite": {
        "path": "assets/ships/587.png",
        "source": "bundled",
        "format": "png",
        "orientation": "unknown",
        "rotation_correction_degrees": 0.0,
        "visual_center": [
          0.0,
          0.0
        ],
        "alpha_required": true,
        "crop_padding_percent": 8.0
      },
      "presentation": {
        "gameplay_size": 47.0,
        "player_scale": 1.15,
        "ui_scale": 1.0,
        "boss_scale": 1.0,
        "tint_mode": "none",
        "interpolation": "linear",
        "engine_offset": [
          0.0,
          -0.4
        ],
        "shadow_scale": 0.85
      },
      "hardpoints": {
        "engines": [],
        "weapons": [],
        "damage": []
      },
      "roles": [
        "player",
        "enemy",
        "menu"
      ],
      "campaigns": [],
      "aliases": [],
      "status": "pending_review",
      "notes": "Seeded from current Rebellion hull references. Visually approve the sprite, orientation, center, and hardpoints before changing status to approved."
    },
    {
      "type_id": 585,
      "slug": "slasher",
      "name": "Slasher",
      "faction": "minmatar",
      "class": "frigate",
      "sprite": {
        "path": "assets/ships/585.png",
        "source": "bundled",
        "format": "png",
        "orientation": "unknown",
        "rotation_correction_degrees": 0.0,
        "visual_center": [
          0.0,
          0.0
        ],
        "alpha_required": true,
        "crop_padding_percent": 8.0
      },
      "presentation": {
        "gameplay_size": 47.0,
        "player_scale": 1.15,
        "ui_scale": 1.0,
        "boss_scale": 1.0,
        "tint_mode": "none",
        "interpolation": "linear",
        "engine_offset": [
          0.0,
          -0.4
        ],
        "shadow_scale": 0.85
      },
      "hardpoints": {
        "engines": [],
        "weapons": [],
        "damage": []
      },
      "roles": [
        "player",
        "enemy",
        "menu"
      ],
      "campaigns": [],
      "aliases": [],
      "status": "pending_review",
      "notes": "Seeded from current Rebellion hull references. Visually approve the sprite, orientation, center, and hardpoints before changing status to approved."
    },
    {
      "type_id": 598,
      "slug": "breacher",
      "name": "Breacher",
      "faction": "minmatar",
      "class": "frigate",
      "sprite": {
        "path": "assets/ships/598.png",
        "source": "bundled",
        "format": "png",
        "orientation": "unknown",
        "rotation_correction_degrees": 0.0,
        "visual_center": [
          0.0,
          0.0
        ],
        "alpha_required": true,
        "crop_padding_percent": 8.0
      },
      "presentation": {
        "gameplay_size": 47.0,
        "player_scale": 1.15,
        "ui_scale": 1.0,
        "boss_scale": 1.0,
        "tint_mode": "none",
        "interpolation": "linear",
        "engine_offset": [
          0.0,
          -0.4
        ],
        "shadow_scale": 0.85
      },
      "hardpoints": {
        "engines": [],
        "weapons": [],
        "damage": []
      },
      "roles": [
        "player",
        "enemy",
        "menu"
      ],
      "campaigns": [],
      "aliases": [],
      "status": "pending_review",
      "notes": "Seeded from current Rebellion hull references. Visually approve the sprite, orientation, center, and hardpoints before changing status to approved."
    },
    {
      "type_id": 11371,
      "slug": "wolf",
      "name": "Wolf",
      "faction": "minmatar",
      "class": "assault_frigate",
      "sprite": {
        "path": "assets/ships/11371.png",
        "source": "bundled",
        "format": "png",
        "orientation": "unknown",
        "rotation_correction_degrees": 0.0,
        "visual_center": [
          0.0,
          0.0
        ],
        "alpha_required": true,
        "crop_padding_percent": 8.0
      },
      "presentation": {
        "gameplay_size": 52.0,
        "player_scale": 1.15,
        "ui_scale": 1.0,
        "boss_scale": 1.0,
        "tint_mode": "none",
        "interpolation": "linear",
        "engine_offset": [
          0.0,
          -0.4
        ],
        "shadow_scale": 0.85
      },
      "hardpoints": {
        "engines": [],
        "weapons": [],
        "damage": []
      },
      "roles": [
        "player",
        "menu"
      ],
      "campaigns": [],
      "aliases": [],
      "status": "pending_review",
      "notes": "Seeded from current Rebellion hull references. Visually approve the sprite, orientation, center, and hardpoints before changing status to approved."
    },
    {
      "type_id": 11400,
      "slug": "jaguar",
      "name": "Jaguar",
      "faction": "minmatar",
      "class": "assault_frigate",
      "sprite": {
        "path": "assets/ships/11400.png",
        "source": "bundled",
        "format": "png",
        "orientation": "unknown",
        "rotation_correction_degrees": 0.0,
        "visual_center": [
          0.0,
          0.0
        ],
        "alpha_required": true,
        "crop_padding_percent": 8.0
      },
      "presentation": {
        "gameplay_size": 52.0,
        "player_scale": 1.15,
        "ui_scale": 1.0,
        "boss_scale": 1.0,
        "tint_mode": "none",
        "interpolation": "linear",
        "engine_offset": [
          0.0,
          -0.4
        ],
        "shadow_scale": 0.85
      },
      "hardpoints": {
        "engines": [],
        "weapons": [],
        "damage": []
      },
      "roles": [
        "player",
        "menu"
      ],
      "campaigns": [],
      "aliases": [],
      "status": "pending_review",
      "notes": "Seeded from current Rebellion hull references. Visually approve the sprite, orientation, center, and hardpoints before changing status to approved."
    },
    {
      "type_id": 11993,
      "slug": "muninn",
      "name": "Muninn",
      "faction": "minmatar",
      "class": "heavy_assault_cruiser",
      "sprite": {
        "path": "assets/ships/11993.png",
        "source": "bundled",
        "format": "png",
        "orientation": "unknown",
        "rotation_correction_degrees": 0.0,
        "visual_center": [
          0.0,
          0.0
        ],
        "alpha_required": true,
        "crop_padding_percent": 8.0
      },
      "presentation": {
        "gameplay_size": 100.0,
        "player_scale": 1.15,
        "ui_scale": 1.0,
        "boss_scale": 1.0,
        "tint_mode": "none",
        "interpolation": "linear",
        "engine_offset": [
          0.0,
          -0.4
        ],
        "shadow_scale": 0.85
      },
      "hardpoints": {
        "engines": [],
        "weapons": [],
        "damage": []
      },
      "roles": [
        "player",
        "enemy",
        "menu"
      ],
      "campaigns": [],
      "aliases": [],
      "status": "pending_review",
      "notes": "Seeded from current Rebellion hull references. Visually approve the sprite, orientation, center, and hardpoints before changing status to approved."
    },
    {
      "type_id": 24483,
      "slug": "nidhoggur",
      "name": "Nidhoggur",
      "faction": "minmatar",
      "class": "carrier",
      "sprite": {
        "path": "assets/ships/24483.png",
        "source": "bundled",
        "format": "png",
        "orientation": "unknown",
        "rotation_correction_degrees": 0.0,
        "visual_center": [
          0.0,
          0.0
        ],
        "alpha_required": true,
        "crop_padding_percent": 8.0
      },
      "presentation": {
        "gameplay_size": 1800.0,
        "player_scale": 1.15,
        "ui_scale": 1.0,
        "boss_scale": 1.0,
        "tint_mode": "none",
        "interpolation": "linear",
        "engine_offset": [
          0.0,
          -0.4
        ],
        "shadow_scale": 0.85
      },
      "hardpoints": {
        "engines": [],
        "weapons": [],
        "damage": []
      },
      "roles": [
        "carrier",
        "background",
        "cinematic"
      ],
      "campaigns": [],
      "aliases": [],
      "status": "pending_review",
      "notes": "Seeded from current Rebellion hull references. Visually approve the sprite, orientation, center, and hardpoints before changing status to approved."
    },
    {
      "type_id": 589,
      "slug": "executioner",
      "name": "Executioner",
      "faction": "amarr",
      "class": "frigate",
      "sprite": {
        "path": "assets/ships/589.png",
        "source": "bundled",
        "format": "png",
        "orientation": "unknown",
        "rotation_correction_degrees": 0.0,
        "visual_center": [
          0.0,
          0.0
        ],
        "alpha_required": true,
        "crop_padding_percent": 8.0
      },
      "presentation": {
        "gameplay_size": 47.0,
        "player_scale": 1.15,
        "ui_scale": 1.0,
        "boss_scale": 1.0,
        "tint_mode": "none",
        "interpolation": "linear",
        "engine_offset": [
          0.0,
          -0.4
        ],
        "shadow_scale": 0.85
      },
      "hardpoints": {
        "engines": [],
        "weapons": [],
        "damage": []
      },
      "roles": [
        "player",
        "enemy",
        "menu"
      ],
      "campaigns": [],
      "aliases": [],
      "status": "pending_review",
      "notes": "Seeded from current Rebellion hull references. Visually approve the sprite, orientation, center, and hardpoints before changing status to approved."
    },
    {
      "type_id": 597,
      "slug": "punisher",
      "name": "Punisher",
      "faction": "amarr",